{"$id":"test_result","$schema":"https://json-schema.org/draft/2020-12/schema","description":"Outcome of one performed test: expected vs measured, judged by a deterministic evaluator.","properties":{"errors":[],"evaluator":{"description":"Deterministic evaluator id, e.g. physics.trim_rpm_split.","type":"string"},"evidence_ids":{"items":{"type":"string"},"type":"array"},"expected":{"properties":{"max":{"type":"number"},"min":{"type":"number"},"outcome":{"type":"string"},"source":{"properties":{"content_hash":{"type":"string"},"kind":{"enum":["kp","manual_page","mode06_limit","physics"]},"ref":{"type":"string"}},"required":["kind"],"type":"object"},"units":{"type":"string"}},"required":["source"],"type":"object"},"measured":{"properties":{"conditions":{"properties":{"ect_c":{"type":"number"},"load_pct":{"type":"number"},"rpm":{"type":"number"}},"type":"object"},"units":{"type":"string"},"value":{}},"required":["value"],"type":"object"},"outcome":{"description":"Evaluator-chosen outcome token from the KP test outcomes.","type":"string"},"result_id":{"type":"string"},"test_id":{"type":"string"}},"required":["evaluator","expected","measured","outcome","result_id","test_id"],"type":"object"}
